{
  "campaign_id": "camp_locos_materos_2026",
  "campaign_name": "Locos Materos — ¿Dónde estás tú? Está tu mate",
  "version": "1.0.0",
  "created_at": "2026-09-19T05:22:42.524183+00:00",
  "updated_at": "2026-09-22T00:00:16.995962+00:00",
  "client": {
    "name": "Locos Materos",
    "industry": "Yerba Mate / Alimentos y Bebidas",
    "brand_values": [
      "Cercanía",
      "Identidad Chilena",
      "Amistad",
      "Comunidad",
      "Autenticidad"
    ],
    "brand_profile_ref": "https://www.locosmateros.cl/"
  },
  "strategic_brief": {
    "objective": "awareness",
    "target_audience": {
      "demographic": "Chilenos y residentes de 20 a 45 años, estudiantes y trabajadores",
      "psychographic": "Personas que valoran la pausa reflexiva, la amistad sincera y los rituales cotidianos compartidos",
      "context": "Santiago de Chile, hogares, calles de barrio, universidades y oficinas"
    },
    "core_message": "Donde estés, tu mate te acompaña. Y cuando hay mate, hay gente.",
    "tone_of_voice": [
      "Cálido",
      "Auténtico",
      "Cotidiano",
      "Emocional",
      "Cinematográfico"
    ],
    "requirements": [
      {
        "id": "req_client_01",
        "type": "CLIENT_REQUIREMENT",
        "description": "El mate debe mantenerse físicamente consistente y realista: calabaza tradicional, yerba real, bombilla de acero inoxidable y termo realista con proporciones exactas.",
        "origin": "Brief del Cliente (MATE)",
        "is_mandatory": true,
        "validation_status": "verified"
      },
      {
        "id": "req_client_02",
        "type": "CLIENT_REQUIREMENT",
        "description": "Nunca generar, inventar ni distorsionar el logotipo de Locos Materos; el logo real se integrará en post-producción.",
        "origin": "Brief del Cliente (IMPORTANT PRODUCT RULE)",
        "is_mandatory": true,
        "validation_status": "verified"
      },
      {
        "id": "req_client_03",
        "type": "CLIENT_REQUIREMENT",
        "description": "Paleta cromática cálida y terrosa: verdes de yerba mate, beige cálido, madera natural, marrón oscuro, crema y carbón.",
        "origin": "Brief del Cliente (COLOR PALETTE)",
        "is_mandatory": true,
        "validation_status": "verified"
      },
      {
        "id": "req_tech_01",
        "type": "TECHNICAL_REQUIREMENT",
        "description": "Formato vertical 9:16 con resolución mínima 1080x1920 a 30 FPS.",
        "origin": "Especificación Técnica (FORMAT)",
        "is_mandatory": true,
        "validation_status": "verified"
      },
      {
        "id": "req_tech_02",
        "type": "TECHNICAL_REQUIREMENT",
        "description": "No generar texto o subtítulos incrustados dentro del video en render inicial; capas de texto deben ser editables en composición gráfica.",
        "origin": "Especificación Técnica (FORMAT)",
        "is_mandatory": true,
        "validation_status": "verified"
      },
      {
        "id": "req_tech_03",
        "type": "TECHNICAL_REQUIREMENT",
        "description": "No usar CGI artificial, ralentizaciones exageradas ni elementos fantásticos.",
        "origin": "Especificación Técnica (FORMAT)",
        "is_mandatory": true,
        "validation_status": "verified"
      },
      {
        "id": "req_user_01",
        "type": "USER_REQUIREMENT",
        "description": "Construir la campaña a través del sistema autónomo ADCRA respetando el flujo de fases y contratos JSON.",
        "origin": "Instrucción del Operador",
        "is_mandatory": true,
        "validation_status": "verified"
      },
      {
        "id": "req_creative_01",
        "type": "CREATIVE_RECOMMENDATION",
        "description": "Progresión narrativa de la soledad a la comunidad: inicio íntimo al amanecer, transición al movimiento cotidiano y clímax en encuentro social.",
        "origin": "Director Creativo (VISUAL STORY)",
        "is_mandatory": false,
        "validation_status": "pending"
      },
      {
        "id": "req_creative_02",
        "type": "CREATIVE_RECOMMENDATION",
        "description": "Look óptico cinematográfico de 35mm/50mm, luz natural de sol matutino/golden hour y movimiento de cámara humano y elegante.",
        "origin": "Director Audiovisual (CAMERA & LIGHTING)",
        "is_mandatory": false,
        "validation_status": "pending"
      },
      {
        "id": "req_agent_01",
        "type": "AGENT_ASSUMPTION",
        "description": "Se asume que la pista de audio 'Entre_mates_y_sol.mp3' en Recursos/Audios es la banda sonora rectora y define la duración del corte a 30 segundos comerciales.",
        "origin": "Detección de activos en workspace",
        "is_mandatory": false,
        "validation_status": "pending"
      }
    ]
  },
  "deliverables": [
    {
      "format_id": "vertical_social_reel",
      "aspect_ratio": "9:16",
      "resolution": {
        "width": 1080,
        "height": 1920
      },
      "fps": 30.0,
      "target_channels": [
        "Instagram Reels",
        "TikTok",
        "YouTube Shorts"
      ],
      "duration_target_seconds": 30.0
    }
  ],
  "workflow_status": {
    "current_phase": "FASE 20 — PILOT RUN COMPLETE",
    "iteration_count": 1,
    "max_iterations": 3,
    "is_approved": true
  }
}